<?xml version="1.0" encoding="UTF-8"?>
<!DOCTYPE personas SYSTEM "personas.dtd">

<personas>
    <persona>
        <nombre>Juan Pardo</nombre>
        <nacimiento dia="10" mes="Abril" anyo="1982" />
        <direccion>
            <calle>caoba, 1</calle>
            <poblacion>Madrid</poblacion>
            <provincia>Madrid</provincia>
            <cpostal>28005</cpostal>
        </direccion>
        <sexo valor="varon" />
    </persona>
    <persona>
        <nombre>Marta Rodr√≠guez</nombre>
        <direccion>
            <calle>Doctor Carulla, 1</calle>
            <poblacion>Barcelona</poblacion>
            <provincia>Barcelona</provincia>
            <cpostal>08940</cpostal>
        </direccion>
        <sexo valor="mujer" />
    </persona>
</personas>